nom,charte,image,"taille image",alternative,légende,appellations,typeappellation,année,pays,région-mère,similaire,sous-régions,localisation,saison,climat,jourssoleil,sol,superficietotale,superficieplantée,exploitations,cépages,vins,volproduction,densité,rendement,wikipedia_url,wikipedia_api
Cour-cheverny,,"Vendanges à Cour-Cheverny 1905.jpg",,,"Vendanges à Cour-Cheverny en 1905",cour-cheverny,"appellation d'origine contrôlée AOC",1993,France,"Vignoble de la vallée de la Loire vallée de la Loire",,Touraine,Loir-et-Cher,,"Climat tempéré tempéré Climat océanique océanique dégradé",,"sablo-argileux, sablo-siliceux, Sol argilo-calcaire argilo-calcaires",,"50 hectares",,"romorantin (cépage) romorantin BLe code international d'écriture des cépages mentionne de signaler la couleur du raisin : B blanc, N noir, Rs rose, G gris.","Vin blanc blancs","2800 hectolitres","minimum de4500 pieds par hectare","60 à 72 hl/ha",https://fr.wikipedia.org/wiki/Cour-cheverny_(AOC),https://fr.wikipedia.org/w/api.php?action=query&prop=revisions&rvprop=content&format=xmlfm&rvsection=0&titles=Cour-cheverny_(AOC)
Haut-Poitou,,,,,,"Haut-PoitouAppellation d'origine#Grammaire Références sur la façon d'orthographier les appellations d'origine","Appellation d'origine contrôlée AOC",2011,France,"Vignoble de la vallée de la Loire vallée de la Loire",,Poitou,"Vienne (département) Vienne et Deux-Sèvres",,"Climat tempéré tempéré Climat océanique océanique dégradé","2000 heures/an","argilo-calcaire (appelé argile à silex), et argilo-siliceux sur sous-sol calcaire",,"754 hectares","Une cave coopérative avec 300 adhérents et 29 caves indépendantes","gamay, cabernet franc, Pinot noir (cépage) pinot noir, sauvignon, et Sauvignon Gris appelé Fié gris","Vin rouge rouges, rosé rosés et Vin blanc blancs","50000 hlGilbert et Gaillard, opcit, p. 203",,"50 hl/ha",https://fr.wikipedia.org/wiki/Haut-Poitou_(AOC),https://fr.wikipedia.org/w/api.php?action=query&prop=revisions&rvprop=content&format=xmlfm&rvsection=0&titles=Haut-Poitou_(AOC)
Jasnières,,"Jasnières AOC.jpg",,,"Vieilles bouteilles de Jasnières",jasnières,"appellation d'origine contrôlée AOC",1937,France,"Vignoble de la vallée de la Loire vallée de la Loire",,Touraine,"Sarthe (département) Sarthe",,"Climat tempéré tempéré Climat océanique océanique dégradé",,"Sol argilo-calcaire argilo-calcaire et argilo-siliceux, sur craie tuffeau",,"80 hectares",,"chenin blanc BLe code international d'écriture des cépages mentionne de signaler la couleur du raisin : B blanc, N noir, Rs rose, G gris.","Vin blanc blancs","2300 hectolitres","minimum de5500 pieds par hectare","35 hl/ha",https://fr.wikipedia.org/wiki/Jasni%C3%A8res,https://fr.wikipedia.org/w/api.php?action=query&prop=revisions&rvprop=content&format=xmlfm&rvsection=0&titles=Jasni%C3%A8res
Montlouis-sur-loire,,"AOC Montlouis-sur-loire 2005.jpg",,,"Montlouis-sur-loire, millésime 2005",montlouis-sur-loire,"appellation d'origine contrôlée AOC",1938,France,"Vignoble de la vallée de la Loire vallée de la Loire",,Touraine,Indre-et-Loire,,"Climat tempéré tempéré Climat océanique océanique dégradé",,"argiles à silex (perruches) et sables alluvionnaires",,"385 hectares",,"chenin blanc","Vin blanc blancs, Vin effervescent pétillants et Vin effervescent mousseux","15000 hectolitres","minimum de6000 pieds par hectare","52 à 65 hl/ha en blanc,65 à 78 hl/ha en mousseux",https://fr.wikipedia.org/wiki/Montlouis-sur-Loire_(AOC),https://fr.wikipedia.org/w/api.php?action=query&prop=revisions&rvprop=content&format=xmlfm&rvsection=0&titles=Montlouis-sur-Loire_(AOC)
Touraine,,"2008-10 Vendanges Chateau La-Roche.jpg",,,"Vignoble de Touraine en automne",touraine,"appellation d'origine contrôlée AOC","1939 (1946 pour les mousseux)",France,"Vignoble de la vallée de la Loire vallée de la Loire",,Touraine,"Indre-et-Loire et Loir-et-Cher",,"Climat tempéré tempéré Climat océanique océanique dégradé",,"Sol argilo-calcaire argilo-calcaire",,"5300 hectares",,"Pinot gris (cépage) pinot gris, pinot meunier et Pinot noir (cépage) pinot noir","Vin rouge rouges, Vin rosé rosés, Vin blanc blancs, Vin effervescent pétillants et mousseux","1700 hectolitres","minimum de4500 pieds à l'hectare","60 à 72 hl/ha en rouge,65 à 75 hl/ha en blanc,72 à 78 hl/ha en mousseux",https://fr.wikipedia.org/wiki/Touraine_(AOC),https://fr.wikipedia.org/w/api.php?action=query&prop=revisions&rvprop=content&format=xmlfm&rvsection=0&titles=Touraine_(AOC)
Touraine-amboise,,"Vignoble pocé.JPG",,,"Vignoble et Cabane de vignes loge de vigne à Pocé-sur-Cisse.",touraine-amboise,"appellation d'origine contrôlée AOC",1954,France,"Vignoble de la vallée de la Loire vallée de la Loire",,Touraine,"Amboise Indre-et-Loire",,"Climat tempéré tempéré Climat océanique océanique dégradé",,"carbonatés, sur tuffeau en haut des pentes ou siliceux et assez lourds, sur sables et graviers argileux",,"220 hectares",,"cabernet franc, cabernet sauvignon, gamay et chenin blanc","60 % Vin rouge rouges, 30 % Vin rosé rosés et 10 % Vin blanc blancs","9000 hectolitres","minimum de6000 pieds par hectare","55 à 63 hl/ha en rouge et en blanc, 55 à 67 en rosé",https://fr.wikipedia.org/wiki/Touraine-amboise,https://fr.wikipedia.org/w/api.php?action=query&prop=revisions&rvprop=content&format=xmlfm&rvsection=0&titles=Touraine-amboise
Touraine-azay-le-rideau,,,,,,touraine-azay-le-rideau,"appellation d'origine contrôlée AOC","1939 (rouge et blanc) et 1976 (rosé)",France,"Vignoble de la vallée de la Loire vallée de la Loire",,Touraine,"Azay-le-Rideau Indre-et-Loire",,"Climat tempéré tempéré Climat océanique océanique dégradé",,"Sol argilo-calcaire argilo-calcaire",,"60 hectares",,"gamay, cabernet franc, cabernet sauvignon et chenin blanc","Vin rosé rosés et Vin blanc blancs","1800 hectolitres","minimum de4500 pieds à l'hectare","55 à 66 hl/ha",https://fr.wikipedia.org/wiki/Touraine-azay-le-rideau,https://fr.wikipedia.org/w/api.php?action=query&prop=revisions&rvprop=content&format=xmlfm&rvsection=0&titles=Touraine-azay-le-rideau
Touraine-mesland,,"JOH 1138 (4862931834).jpg",,,"AOC Touraine-mesland rouge",touraine,"appellation d'origine contrôlée AOC",1955,France,"Vignoble de la vallée de la Loire vallée de la Loire",,Touraine,"Mesland, Loir-et-Cher",,"Climat tempéré tempéré Climat océanique océanique dégradé",,"argilo-siliceux, parsemés de sables anciensGuide Vert Solar : ''Vins de France''. (Page n°264 sur ''Touraine-mesland'')",,"105 hectares",,"gamay, cabernet franc, côt et chenin blanc","70 % Vin rouge rouges, 15 % Vin rosé rosés et 15 % Vin blanc blancs","5000 hectolitres","minimum de4500 pieds à l'hectare","55 à 67 hl/ha en rouge,60 à 70 hl/ha en blanc",https://fr.wikipedia.org/wiki/Touraine-mesland,https://fr.wikipedia.org/w/api.php?action=query&prop=revisions&rvprop=content&format=xmlfm&rvsection=0&titles=Touraine-mesland
Touraine-noble-joué,,,,,,touraine-noble-joué,"appellation d'origine contrôlée AOC",2001,France,"Vignoble de la vallée de la Loire vallée de la Loire",,"Touraine (AOC) Touraine",Indre-et-Loire,,"Climat tempéré tempéré Climat océanique océanique dégradé",,"Sol argilo-calcaire argilo-calcaire",,"28 hectares",,"pinot meunier","Vin rosé rosés","1700 hectolitres","minimum de6500 pieds à l'hectare","55 à 67 hl/ha",https://fr.wikipedia.org/wiki/Touraine-noble-jou%C3%A9,https://fr.wikipedia.org/w/api.php?action=query&prop=revisions&rvprop=content&format=xmlfm&rvsection=0&titles=Touraine-noble-jou%C3%A9
Vouvray,,Chapelle-Gaudrelle.JPG,,,"Le vignoble dominé par le clocher de l'église de Vouvray.",vouvray,"Appellation d'origine contrôlée AOC",1936,France,"Vignoble de la vallée de la Loire vallée de la Loire",,Touraine,Indre-et-Loire,,"Climat tempéré tempéré Climat océanique océanique dégradé",,"argilo-calcaires et argileux à silex sur sous-sol crayeux",,"2000 hectares",,"chenin blanc","60 % blancs vin effervescent effervescents et 40 % vin blanc blancs tranquilles","115000 hectolitres","minimum de6000 pieds par hectare","52 à 65 hl/ha en tranquille,65 à 78 hl/ha en effervescent",https://fr.wikipedia.org/wiki/Vouvray_(AOC),https://fr.wikipedia.org/w/api.php?action=query&prop=revisions&rvprop=content&format=xmlfm&rvsection=0&titles=Vouvray_(AOC)

